{
  "schema_version": 1,
  "id": "issue-1-public-build-lasso-reference-manifest",
  "source": {
    "repository": "https://github.com/AzureAD/microsoft-authentication-cli",
    "commit": "de20930c34b3b86c8a0ed7bbdeeca3f662dae918",
    "build_entry_point": "AzureAuth.sln"
  },
  "references": [
{"id":"lasso-ref-001","kind":"namespace-import","line":9,"path":"src/AzureAuth.Test/Ado/PatFromEnvTest.cs","symbol":"Microsoft.Office.Lasso.Interfaces"},
{"id":"lasso-ref-002","kind":"unqualified-symbol","line":20,"path":"src/AzureAuth.Test/Ado/PatFromEnvTest.cs","symbol":"IEnv"},
{"id":"lasso-ref-003","kind":"unqualified-symbol","line":25,"path":"src/AzureAuth.Test/Ado/PatFromEnvTest.cs","symbol":"IEnv"},
{"id":"lasso-ref-004","kind":"unqualified-symbol","line":37,"path":"src/AzureAuth.Test/Ado/PatFromEnvTest.cs","symbol":"IEnv.Get"},
{"id":"lasso-ref-005","kind":"unqualified-symbol","line":38,"path":"src/AzureAuth.Test/Ado/PatFromEnvTest.cs","symbol":"IEnv.Get"},
{"id":"lasso-ref-006","kind":"unqualified-symbol","line":53,"path":"src/AzureAuth.Test/Ado/PatFromEnvTest.cs","symbol":"IEnv.Get"},
{"id":"lasso-ref-007","kind":"unqualified-symbol","line":54,"path":"src/AzureAuth.Test/Ado/PatFromEnvTest.cs","symbol":"IEnv.Get"},
{"id":"lasso-ref-008","kind":"unqualified-symbol","line":73,"path":"src/AzureAuth.Test/Ado/PatFromEnvTest.cs","symbol":"IEnv.Get"},
{"id":"lasso-ref-009","kind":"unqualified-symbol","line":89,"path":"src/AzureAuth.Test/Ado/PatFromEnvTest.cs","symbol":"IEnv.Get"},
{"id":"lasso-ref-010","kind":"unqualified-symbol","line":90,"path":"src/AzureAuth.Test/Ado/PatFromEnvTest.cs","symbol":"IEnv.Get"},
{"id":"lasso-ref-011","kind":"unqualified-symbol","line":28,"path":"src/AzureAuth.Test/AuthFlowResultExtensionsTest.cs","symbol":"EventData"},
{"id":"lasso-ref-012","kind":"unqualified-symbol","line":41,"path":"src/AzureAuth.Test/AuthFlowResultExtensionsTest.cs","symbol":"EventData"},
{"id":"lasso-ref-013","kind":"unqualified-symbol","line":44,"path":"src/AzureAuth.Test/AuthFlowResultExtensionsTest.cs","symbol":"EventData.Properties"},
{"id":"lasso-ref-014","kind":"unqualified-symbol","line":45,"path":"src/AzureAuth.Test/AuthFlowResultExtensionsTest.cs","symbol":"EventData.Properties"},
{"id":"lasso-ref-015","kind":"unqualified-symbol","line":46,"path":"src/AzureAuth.Test/AuthFlowResultExtensionsTest.cs","symbol":"EventData.Measures"},
{"id":"lasso-ref-016","kind":"unqualified-symbol","line":47,"path":"src/AzureAuth.Test/AuthFlowResultExtensionsTest.cs","symbol":"EventData.Properties"},
{"id":"lasso-ref-017","kind":"unqualified-symbol","line":49,"path":"src/AzureAuth.Test/AuthFlowResultExtensionsTest.cs","symbol":"EventData.Properties"},
{"id":"lasso-ref-018","kind":"unqualified-symbol","line":50,"path":"src/AzureAuth.Test/AuthFlowResultExtensionsTest.cs","symbol":"EventData.Properties"},
{"id":"lasso-ref-019","kind":"unqualified-symbol","line":51,"path":"src/AzureAuth.Test/AuthFlowResultExtensionsTest.cs","symbol":"EventData.Measures"},
{"id":"lasso-ref-020","kind":"unqualified-symbol","line":69,"path":"src/AzureAuth.Test/AuthFlowResultExtensionsTest.cs","symbol":"EventData"},
{"id":"lasso-ref-021","kind":"unqualified-symbol","line":72,"path":"src/AzureAuth.Test/AuthFlowResultExtensionsTest.cs","symbol":"EventData.Properties"},
{"id":"lasso-ref-022","kind":"unqualified-symbol","line":73,"path":"src/AzureAuth.Test/AuthFlowResultExtensionsTest.cs","symbol":"EventData.Measures"},
{"id":"lasso-ref-023","kind":"unqualified-symbol","line":74,"path":"src/AzureAuth.Test/AuthFlowResultExtensionsTest.cs","symbol":"EventData.Properties"},
{"id":"lasso-ref-024","kind":"unqualified-symbol","line":75,"path":"src/AzureAuth.Test/AuthFlowResultExtensionsTest.cs","symbol":"EventData.Properties"},
{"id":"lasso-ref-025","kind":"unqualified-symbol","line":76,"path":"src/AzureAuth.Test/AuthFlowResultExtensionsTest.cs","symbol":"EventData.Properties"},
{"id":"lasso-ref-026","kind":"unqualified-symbol","line":77,"path":"src/AzureAuth.Test/AuthFlowResultExtensionsTest.cs","symbol":"EventData.Properties"},
{"id":"lasso-ref-027","kind":"unqualified-symbol","line":78,"path":"src/AzureAuth.Test/AuthFlowResultExtensionsTest.cs","symbol":"EventData.Measures"},
{"id":"lasso-ref-028","kind":"unqualified-symbol","line":107,"path":"src/AzureAuth.Test/AuthFlowResultExtensionsTest.cs","symbol":"EventData"},
{"id":"lasso-ref-029","kind":"unqualified-symbol","line":110,"path":"src/AzureAuth.Test/AuthFlowResultExtensionsTest.cs","symbol":"EventData.Properties"},
{"id":"lasso-ref-030","kind":"unqualified-symbol","line":111,"path":"src/AzureAuth.Test/AuthFlowResultExtensionsTest.cs","symbol":"EventData.Properties"},
{"id":"lasso-ref-031","kind":"unqualified-symbol","line":112,"path":"src/AzureAuth.Test/AuthFlowResultExtensionsTest.cs","symbol":"EventData.Properties"},
{"id":"lasso-ref-032","kind":"unqualified-symbol","line":113,"path":"src/AzureAuth.Test/AuthFlowResultExtensionsTest.cs","symbol":"EventData.Properties"},
{"id":"lasso-ref-033","kind":"unqualified-symbol","line":114,"path":"src/AzureAuth.Test/AuthFlowResultExtensionsTest.cs","symbol":"EventData.Properties"},
{"id":"lasso-ref-034","kind":"unqualified-symbol","line":115,"path":"src/AzureAuth.Test/AuthFlowResultExtensionsTest.cs","symbol":"EventData.Measures"},
{"id":"lasso-ref-035","kind":"unqualified-symbol","line":116,"path":"src/AzureAuth.Test/AuthFlowResultExtensionsTest.cs","symbol":"EventData.Measures"},
{"id":"lasso-ref-036","kind":"unqualified-symbol","line":131,"path":"src/AzureAuth.Test/AuthFlowResultExtensionsTest.cs","symbol":"EventData"},
{"id":"lasso-ref-037","kind":"unqualified-symbol","line":134,"path":"src/AzureAuth.Test/AuthFlowResultExtensionsTest.cs","symbol":"EventData.Properties"},
{"id":"lasso-ref-038","kind":"unqualified-symbol","line":135,"path":"src/AzureAuth.Test/AuthFlowResultExtensionsTest.cs","symbol":"EventData.Properties"},
{"id":"lasso-ref-039","kind":"unqualified-symbol","line":136,"path":"src/AzureAuth.Test/AuthFlowResultExtensionsTest.cs","symbol":"EventData.Properties"},
{"id":"lasso-ref-040","kind":"unqualified-symbol","line":137,"path":"src/AzureAuth.Test/AuthFlowResultExtensionsTest.cs","symbol":"EventData.Properties"},
{"id":"lasso-ref-041","kind":"unqualified-symbol","line":138,"path":"src/AzureAuth.Test/AuthFlowResultExtensionsTest.cs","symbol":"EventData.Properties"},
{"id":"lasso-ref-042","kind":"unqualified-symbol","line":139,"path":"src/AzureAuth.Test/AuthFlowResultExtensionsTest.cs","symbol":"EventData.Measures"},
{"id":"lasso-ref-043","kind":"unqualified-symbol","line":140,"path":"src/AzureAuth.Test/AuthFlowResultExtensionsTest.cs","symbol":"EventData.Measures"},
{"id":"lasso-ref-044","kind":"namespace-import","line":12,"path":"src/AzureAuth.Test/AuthModeExtensionsTest.cs","symbol":"Microsoft.Office.Lasso.Interfaces"},
{"id":"lasso-ref-045","kind":"unqualified-symbol","line":22,"path":"src/AzureAuth.Test/AuthModeExtensionsTest.cs","symbol":"IEnv"},
{"id":"lasso-ref-046","kind":"unqualified-symbol","line":29,"path":"src/AzureAuth.Test/AuthModeExtensionsTest.cs","symbol":"IEnv"},
{"id":"lasso-ref-047","kind":"unqualified-symbol","line":38,"path":"src/AzureAuth.Test/AuthModeExtensionsTest.cs","symbol":"IEnv.Get"},
{"id":"lasso-ref-048","kind":"unqualified-symbol","line":39,"path":"src/AzureAuth.Test/AuthModeExtensionsTest.cs","symbol":"IEnv.Get"},
{"id":"lasso-ref-049","kind":"unqualified-symbol","line":53,"path":"src/AzureAuth.Test/AuthModeExtensionsTest.cs","symbol":"IEnv.Get"},
{"id":"lasso-ref-050","kind":"unqualified-symbol","line":66,"path":"src/AzureAuth.Test/AuthModeExtensionsTest.cs","symbol":"IEnv.Get"},
{"id":"lasso-ref-051","kind":"unqualified-symbol","line":67,"path":"src/AzureAuth.Test/AuthModeExtensionsTest.cs","symbol":"IEnv.Get"},
{"id":"lasso-ref-052","kind":"unqualified-symbol","line":83,"path":"src/AzureAuth.Test/AuthModeExtensionsTest.cs","symbol":"IEnv.Get"},
{"id":"lasso-ref-053","kind":"unqualified-symbol","line":97,"path":"src/AzureAuth.Test/AuthModeExtensionsTest.cs","symbol":"IEnv.Get"},
{"id":"lasso-ref-054","kind":"namespace-import","line":22,"path":"src/AzureAuth.Test/CommandAadTest.cs","symbol":"Microsoft.Office.Lasso.Interfaces"},
{"id":"lasso-ref-055","kind":"namespace-import","line":23,"path":"src/AzureAuth.Test/CommandAadTest.cs","symbol":"Microsoft.Office.Lasso.Telemetry"},
{"id":"lasso-ref-056","kind":"unqualified-symbol","line":61,"path":"src/AzureAuth.Test/CommandAadTest.cs","symbol":"CommandExecuteEventData"},
{"id":"lasso-ref-057","kind":"unqualified-symbol","line":65,"path":"src/AzureAuth.Test/CommandAadTest.cs","symbol":"IEnv"},
{"id":"lasso-ref-058","kind":"unqualified-symbol","line":66,"path":"src/AzureAuth.Test/CommandAadTest.cs","symbol":"ITelemetryService"},
{"id":"lasso-ref-059","kind":"unqualified-symbol","line":75,"path":"src/AzureAuth.Test/CommandAadTest.cs","symbol":"CommandExecuteEventData..ctor"},
{"id":"lasso-ref-060","kind":"unqualified-symbol","line":86,"path":"src/AzureAuth.Test/CommandAadTest.cs","symbol":"IEnv"},
{"id":"lasso-ref-061","kind":"unqualified-symbol","line":87,"path":"src/AzureAuth.Test/CommandAadTest.cs","symbol":"ITelemetryService"},
{"id":"lasso-ref-062","kind":"unqualified-symbol","line":115,"path":"src/AzureAuth.Test/CommandAadTest.cs","symbol":"IEnv.Get"},
{"id":"lasso-ref-063","kind":"unqualified-symbol","line":163,"path":"src/AzureAuth.Test/CommandAadTest.cs","symbol":"IEnv.Get"},
{"id":"lasso-ref-064","kind":"unqualified-symbol","line":205,"path":"src/AzureAuth.Test/CommandAadTest.cs","symbol":"IEnv.Get"},
{"id":"lasso-ref-065","kind":"unqualified-symbol","line":238,"path":"src/AzureAuth.Test/CommandAadTest.cs","symbol":"IEnv.Get"},
{"id":"lasso-ref-066","kind":"unqualified-symbol","line":239,"path":"src/AzureAuth.Test/CommandAadTest.cs","symbol":"IEnv.Get"},
{"id":"lasso-ref-067","kind":"unqualified-symbol","line":279,"path":"src/AzureAuth.Test/CommandAadTest.cs","symbol":"IEnv.Get"},